show_id,type,title,director,cast,country,year_added,release_year,rating,duration,category
80176234,"TV Show","Black Money Love","Ahmet Katıksız","Güler Ökten, Hazal Türesan, İlkin Tüfekçi, Bedia Ener, Erkan Can, Öykü Karayel, Emre Kızılırmak, Bestemsu Özdemir, Engin Akyürek, Burak Tamdoğan, Saygın Soysal, Tuba Büyüküstün, Ali Yörenç, Ahmet Tansu Taşanlar, Elif İnci",Turkey,2019,2014,TV-MA,"1 Season","Crime TV Shows, International TV Shows, TV Dramas"
80992769,Movie,"Dark Crimes","Alexandros Avranas","Jim Carrey, Marton Csokas, Charlotte Gainsbourg, Agata Kulesza, Kati Outinen, Zbigniew Zamachowski, Danuta Kowalska, Vlad Ivanov, Robert Więckiewicz, Piotr Głowacki","United Kingdom, Poland, United States",2019,2016,R,"93 min","Dramas, Thrillers"
81191228,Movie,Homeland,"Anindya Chatterjee","Parambrata Chatterjee, Ani Hovhannisyan, Jonathan Dumontier, Varzu, Sylvie de Neef, Prakashchandra Roy, Nicolas Pierson, Anahit Simonyan",,2019,2019,TV-PG,"73 min","Dramas, Independent Movies, International Movies"
81154549,"TV Show","Magical Andes",,,,2019,2019,TV-G,"1 Season","Docuseries, International TV Shows, Science & Nature TV"
81192594,"TV Show","Power Rangers Beast Morphers",,"Rorrie D. Travis, Jazz Baduwalia, Jacqueline Scislowski, Abraham Rodríguez, Teuila Blakely, Kristina Ho, Cosme Flores, Kevin Copeland","United States",2019,2019,TV-Y7-FV,"1 Season","Kids' TV"
81006356,"TV Show","Devlok with Devdutt Pattanaik",,"Rasika Dugal, Devdutt Pattanaik",India,2018,2017,TV-PG,"1 Season","International TV Shows"
81025935,Movie,"Meghnadbodh Rohoshyo","Anik Datta","Barun Chanda, Sabyasachi Chakraborty",India,2018,2017,TV-14,"150 min","Dramas, International Movies"
81020508,Movie,Sanju,"Rajkumar Hirani","Ranbir Kapoor, Vicky Kaushal, Paresh Rawal, Sonam Kapoor, Dia Mirza, Jim Sarbh, Anushka Sharma, Manisha Koirala, Boman Irani",India,2018,2018,TV-MA,"159 min","Dramas, International Movies"
80241004,"TV Show","Stunt Science",,,"United Kingdom",2018,2018,TV-MA,"1 Season","British TV Shows, International TV Shows, Reality TV"
80201824,Movie,"A Scandall","Ishaan Trivedi","Johnny Baweja, Reeth Mazumder, Manav Kaul, Tanvi Vyas, Puru Chibber, Vasundhara Kaul, Aayam Mehta, Niraj Sah",India,2017,2016,TV-MA,"108 min","International Movies, Thrillers"
80203782,Movie,"Aisa Yeh Jahaan","Biswajeet Bora","Palash Sen, Ira Dubey, Yashpal Sharma, Tinnu Anand, Prisha Dabbas, Kymsleen Kholie, Satish Sharma",India,2017,2015,TV-14,"127 min","Dramas, Independent Movies, International Movies"
80201829,Movie,"Ankur Arora Murder Case","Sohail Tatari","Kay Kay Menon, Tisca Chopra, Arjun Mathur, Paoli Dam, Vishakha Singh, Manish Chaudhary, Vishesh Tiwari, Harsh Chhaya",India,2017,2013,TV-14,"127 min","Dramas, International Movies, Thrillers"
80126016,Movie,"Belief: The Possession of Janet Moses","David Stubbs","Kura Forrester, William Davis, Tina Cook, Hariata Moriarty","New Zealand",2017,2015,TV-MA,"90 min","Documentaries, International Movies"
80202089,Movie,"Calendar Girls","Madhur Bhandarkar","Akanksha Puri, Avani Modi, Kyra Dutt, Ruhi Singh, Satarupa Pyne, Mita Vashisht, Keith Sequeira, Deepak Wadhwa, Indraneil Sengupta, Vikram Sakhalkar",India,2017,2015,TV-14,"126 min","Dramas, International Movies"
80203789,Movie,Darra,"Parveen Kumar","Gurpreet Ghuggi, Happy Raikoti, Kartar Cheema, Sardar Sohi, Shavendra Mahal, Karamjit Anmol, Pammi Bai, Nirmal Rishi, Manpreet Saggu",India,2017,2016,TV-14,"121 min","Dramas, International Movies"
80193423,Movie,"El Che","Matías Gueilburt","Paco Ignacio Taibo II",Venezuela,2017,2017,TV-14,"119 min","Documentaries, International Movies"
80201825,Movie,"Gour Hari Dastaan: The Freedom File","Ananth Narayan Mahadevan","Vinay Pathak, Konkona Sen Sharma, Ranvir Shorey, Tannishtha Chatterjee, Rajit Kapoor, Vikram Gokhale, Vipin Sharma, Rahul Vohra, Saurabh Shukla, Asrani",India,2017,2015,TV-14,"109 min","Dramas, Independent Movies, International Movies"
80202376,"TV Show","Harry & Bunnie","Ah Loong",,Malaysia,2017,2017,TV-Y7,"1 Season","Kids' TV, TV Comedies"
80028360,Movie,Jal,"Girish Malik","Purab Kohli, Tannishtha Chatterjee, Kirti Kulhari, Yashpal Sharma, Mukul Dev, Saidah Jules, Ravi Gossain, Rahul Singh",India,2017,2013,TV-14,"132 min","Dramas, Independent Movies, International Movies"
80203783,Movie,"Macchli Jal Ki Rani Hai","Debaloy Dey","Swara Bhaskar, Bhanu Uday, Murli Sharma, Deep Raj Rana, Reema Debnath, Hemant Pandey, Saurabh Dubey, Sakha Kalyani",India,2017,2014,TV-MA,"118 min","Horror Movies, International Movies"
80142617,Movie,Money,"Martin Rosete","Kellan Lutz, Jess Weixler, Jesse Williams, Jamie Bamber, Lucía Guerrero, Fredric Lehne","United States, Spain",2017,2016,R,"84 min",Thrillers
80201823,Movie,"One Night Stand","Jasmine D'Souza","Tanuj Virwani, Sunny Leone, Narendra Jetley, Aamir Ahmed, Kapil Punjabi, Madhurima Banerjee, Ninad Kamat, Geeta Bisht",India,2017,2016,TV-MA,"93 min","Dramas, International Movies, Music & Musicals"
80190841,Movie,OtherLife,"Ben C. Lucas","Jessica De Gouw, T.J. Power, Thomas Cocquerel, Liam Graham, Clarence John Ryan, Maggie Meyer, Tiriel Mora, Priscilla-Anne Forder, Adriane Daff, Ian Toyne","Australia, United Arab Emirates",2017,2017,TV-MA,"96 min","Dramas, Independent Movies, International Movies"
80115858,Movie,"Sardaarji 2","Rohit Jugraj","Jaswinder Bhalla, Sonam Bajwa, Diljit Dosanjh, Monica Gill","Australia, India",2017,2016,TV-PG,"145 min","Action & Adventure, Comedies, International Movies"
80183199,"TV Show","Seven and Me",,"Leila Jolene, Flavio Parenti, Josefin Asplund",France,2017,2017,TV-G,"1 Season","Kids' TV"
80158547,Movie,Singapore,"Shakti Samanta","Shammi Kapoor, Padmini, Maria Menado, Shashikala, Agha, K.N. Singh, Madan Puri, Helen","India, Malaysia",2017,1960,TV-PG,"158 min","Comedies, Dramas, International Movies"
80206827,Movie,"Story of an Egg","Raj B. Shetty","Raj B. Shetty, Usha Bhandary, Shailashree, Prakash Tuminadu, Amrutha Naik, Shreya Anchan, VJ Vineeth, Rahul Amin, Deepak Rai Panaje, Ramdas",India,2017,2017,TV-PG,"132 min","Comedies, International Movies, Romantic Movies"
80202090,Movie,Tamanchey,"Navneet Behal","Nikhil Dwivedi, Richa Chadha, Damandeep Singh Baggan, Vijay Pande, Talib Mehdi, Tushar Phulke, Mahesh Gupta, Prasad Labhe",India,2017,2014,TV-MA,"111 min","Action & Adventure, International Movies, Romantic Movies"
80203790,Movie,Teshan,"Sukhbir Singh","Happy Raikoti, Diljott, Prince Kanwaljit Singh, Karamjit Anmol, Harinder Bhullar, Virast Sandhu, Anita Devgan, Simran Sehajpal",India,2017,2016,TV-PG,"133 min","Comedies, International Movies, Romantic Movies"
80158391,Movie,Ujala,"Naresh Saigal","Mala Sinha, Shammi Kapoor, Raaj Kumar, Leela Chitnis, Dhumal, Kumkum",India,2017,1959,TV-PG,"143 min","Dramas, International Movies"
80201822,Movie,Veerappan,"Ram Gopal Varma","Sandeep Bharadwaj, Sachiin Joshi, Lisa Ray, Usha Jadhav, Nissar Khan, Krishna Shrikanth Iyengar",India,2017,2016,TV-14,"117 min","Action & Adventure, Dramas, International Movies"
80211540,Movie,"Why Knot","Dhruv Dhawan",,"Canada, India, Thailand, United States, United Arab Emirates",2017,2016,TV-MA,"84 min",Documentaries
80123743,Movie,"A Mighty Team","Thomas Sorriaux","Gérard Depardieu, Chantal Lauby, Medi Sadoun, Ilian Bergala, Blanche Gardin, Patrick Timsit, Barbara Cabrita, Jean Dell, Thomas Vandenberghe, Théo Fernandez, Léa Lopez",France,2016,2016,TV-14,"97 min","Comedies, International Movies, Sports Movies"
70258995,Movie,"Berserk: The Golden Age Arc I - The Egg of the King","Toshiyuki Kubooka","Hiroaki Iwanaga, Takahiro Sakurai, Toa Yukinari, Yuki Kaji, Minako Kotobuki, Takahiro Fujiwara, Yoshiro Matsumoto, Kazuki Yao, Aki Toyosaki, Rikiya Koyama, Kenta Miyake",Japan,2016,2012,TV-MA,"77 min","Action & Adventure, Anime Features, International Movies"
70208801,Movie,"Bleach The Movie: Fade to Black","Noriyuki Abe","Masakazu Morita, Fumiko Orikasa, Aya Hirano, Hiroshi Kamiya, Mitsuaki Madono, Ryotaro Okiayu, Kentaro Ito, Shinichiro Miki, Satsuki Yukino, Masaaki Tsukada",Japan,2016,2008,NR,"94 min","Action & Adventure, Anime Features, Sci-Fi & Fantasy"
70260383,Movie,"Bleach the Movie: Hell Verse","Noriyuki Abe","Masakazu Morita, Fumiko Orikasa, Kazuya Nakai, Noriaki Sugiyama, Kentarô Itô, Yuki Matsuoka, Ryotaro Okiayu, Romi Park",Japan,2016,2010,NR,"94 min","Action & Adventure, Anime Features, Sci-Fi & Fantasy"
80123744,Movie,"Blind Date","Clovis Cornillac","Mélanie Bernier, Clovis Cornillac, Lilou Fogli, Philippe Duquesne, Grégoire Oestermann, Oscar Copp, Boris Terral, Manu Payet",France,2016,2015,TV-14,"91 min","Comedies, International Movies, Romantic Movies"
70204970,"TV Show","DEATH NOTE",,"Kappei Yamaguchi, Alessandro Juliani, Mamoru Miyano, Brad Swaile, Ai Satou, Saffron Henderson, Akeno Watanabe, Lisa Ann Beley, Aya Hirano, Shannon Chan-Kent, Haruka Kudo, Kelly Metzger, Hideo Ishikawa, Brian Dobson, Hiroki Takahashi, Sam Vincent, Shido Nakamura, Brian Drummond, Naoya Uchida, Chris Britton",Japan,2016,2006,TV-14,"1 Season","Anime Series, Crime TV Shows, International TV Shows"
70105699,Movie,"Naruto Shippûden the Movie: Bonds","Hajime Kamegaki","Junko Takeuchi, Noriaki Sugiyama, Chie Nakamura, Kazuhiko Inoue, Satoshi Hino, Shinji Kawada, Nana Mizuki, Showtaro Morikubo, Rikiya Koyama, Motoko Kumai, Unsho Ishizuka",Japan,2016,2008,TV-14,"93 min","Action & Adventure, Anime Features, International Movies"
70124999,Movie,"Naruto Shippuden: The Movie","Hajime Kamegaki","Junko Takeuchi, Chie Nakamura, Yoichi Masukawa, Kôichi Tôchika, Masako Katsuki, Keiko Nemoto, Kazuhiko Inoue, Masashi Ebara, Showtaro Morikubo, Romi Park, Ayumi Fujimura, Fumiko Orikasa",Japan,2016,2007,TV-14,"95 min","Action & Adventure, Anime Features, International Movies"
80088507,"TV Show","Power Rangers Dino Super Charge",,"Brennan Mejia, Camille Hyde, Yoshi Sudarso, Michael Taber, James Davies, Claire Blackwelder","United States",2016,2016,TV-Y7,"1 Season","Kids' TV"
80080727,"TV Show",Spotless,,"Marc-André Grondin, Denis Ménochet, Miranda Raison, Doug Allen, Liam Garrigan, Ciarán Owens, Kate Magowan, Tanya Fear, Naomi Radcliffe, Lucy Akhurst, Jemma Donovan, Niall Hayes, Brendan Coyle","United Kingdom, France",2016,2015,TV-MA,"1 Season","Crime TV Shows, International TV Shows, TV Dramas"
80990869,Movie,"Martin Matte: La vie, la mort...eh la la..!","Jean-François Blais","Martin Matte",Canada,2019,2019,TV-14,"62 min","Stand-Up Comedy"
80187205,Movie,"This Is Not What I Expected","Derek Hui","Takeshi Kaneshiro, Zhou Dongyu, Sun Yizhou, Ming Xi, Tony Yang, Lin Chi-ling",China,2017,2017,TV-PG,"107 min","Comedies, International Movies, Romantic Movies"
80097472,Movie,"Sky Ladder: The Art of Cai Guo-Qiang","Kevin MacDonald","Cai Guo-Qiang","United States",2016,2016,TV-MA,"80 min",Documentaries
80075009,Movie,Suburra,"Stefano Sollima","Pierfrancesco Favino, Elio Germano, Claudio Amendola, Alessandro Borghi, Greta Scarano, Giulia Gorietti, Jean-Hugues Anglade, Antonello Fassari, Lidia Vitale","Italy, France",2015,2015,NR,"135 min","Dramas, International Movies, Thrillers"
70293417,"TV Show","Russell Peters vs. the World",,"Russell Peters","United States",2013,2013,NR,"1 Season","Docuseries, Stand-Up Comedy & Talk Shows"
70280748,Movie,"Russell Peters: Notorious","Dave Higby","Russell Peters","United States",2013,2013,NR,"72 min","Stand-Up Comedy"
81034012,Movie,"Street Flow","Leïla Sy, Kery James","Kery James, Jammeh Diangana, Chloé Jouannet, Bakary Diombera",France,2019,2019,TV-MA,"96 min","Dramas, International Movies"
81191500,"TV Show","The Lies Within",,"Lee Min-ki, Lee Yoo-young, On Ju-wan, Lee Jun-hyeok, Yun Jong-seok, Kim Jong-soo, Seo Hyun-woo, Song Young-chang, Lee Jun-hyuk","South Korea",2019,2019,TV-14,"1 Season","Crime TV Shows, International TV Shows, Korean TV Shows"
81019031,Movie,Soorma,"Shaad Ali","Diljit Dosanjh, Tapsee Pannu, Angad Bedi, Kulbhushan Kharbanda, Satish Kaushik, Vijay Raaz, Seema Kaushal, Mahabir Bhullar, Alka Badola Kaushal, Jimmy Moses",India,2018,2018,TV-14,"131 min","Dramas, International Movies, Sports Movies"
80180544,"TV Show","Ajaibnya Cinta",,,,2017,2015,TV-PG,"1 Season","International TV Shows, TV Dramas"
80148070,Movie,"Blessed Benefit","Mahmoud al Massad","Ahmad Thaher, Maher Khammash, Odai Hijazi, Nadeem Rimawi, Mahmoud al Massad, Nadim Mushahwar","Germany, Jordan, Netherlands",2017,2016,TV-14,"83 min","Comedies, Dramas, International Movies"
80155812,Movie,"Clair Obscur","Yesim Ustaoglu","Funda Eryiğit, Ecem Uzun, Mehmet Kurtulus, Okan Yalabik, Serkan Keskin, Sema Poyraz","Turkey, France, Germany, Poland",2017,2016,TV-MA,"102 min","Dramas, International Movies"
80183198,Movie,"El Especial de Alex Fernández, el Especial","Jan Suter","Alex Fernández",Mexico,2017,2017,TV-MA,"52 min","Stand-Up Comedy"
80158844,Movie,"Kingdom of Us","Lucy Cohen",,"United Kingdom",2017,2017,TV-MA,"110 min",Documentaries
80164456,Movie,"The Babysitter",McG,"Samara Weaving, Hana Mae Lee, Judah Lewis, Robbie Amell, Bella Thorne, Andrew Bachelor, Emily Alyn Lind, Leslie Bibb, Ken Marino","United States",2017,2017,TV-MA,"85 min","Comedies, Horror Movies"
80174434,Movie,"The Meyerowitz Stories (New and Selected)","Noah Baumbach","Adam Sandler, Ben Stiller, Dustin Hoffman, Elizabeth Marvel, Grace Van Patten, Emma Thompson, Candice Bergen, Rebecca Miller, Danny Flaherty, Sakina Jaffrey, Adam David Thompson","United States",2017,2017,TV-MA,"113 min","Comedies, Dramas, Independent Movies"
80075476,Movie,Mascots,"Christopher Guest","Carrie Aizley, Sarah Baker, Bob Balaban, Ed Begley Jr., Tom Bennett, Maria Blasucci, Jennifer Coolidge, Kerry Godliman, Matt Griesser, Christopher Guest, John Michael Higgins, Michael Hitchcock, Don Lake, Jane Lynch, Christopher Moynihan, Chris O'Dowd, Jim Piddock, Parker Posey, Harry Shearer, Fred Willard, Zach Woods, Susan Yeagley","United States",2016,2016,TV-MA,"95 min",Comedies
80158148,Movie,Apostle,"Gareth Evans","Dan Stevens, Lucy Boynton, Michael Sheen, Mark Lewis Jones, Bill Milner, Kristine Froseth, Paul Higgins, Richard Elfyn, Elen Rhys, Ross O'Hennessy","United Kingdom, United States",2018,2018,TV-MA,"130 min","Horror Movies, International Movies, Thrillers"
80119451,"TV Show","Black Heart",,"Barış Kılıç, Tuvana Türkay, Serhat Tutumluer, Gülçin Santırcıoğlu, Kenan Bal",Turkey,2018,2014,TV-14,"1 Season","Crime TV Shows, International TV Shows, TV Dramas"
80239565,Movie,"Errementari: The Blacksmith and the Devil","Paul Urkijo Alijo","Kandido Uranga, Uma Bracaglia, Eneko Sagardoy, Ramón Agirre, Josean Bengoetxea, Gotzon Sánchez, José Ramón Argoitia, Gorka Aguinagalde, Iñigo de la Iglesia, Aitor Urtzelai","Spain, France",2018,2018,TV-MA,"99 min","Horror Movies, International Movies, Sci-Fi & Fantasy"
80216844,Movie,"Feminists: What Were They Thinking?","Johanna Demetrakas",,"United States",2018,2018,TV-MA,"86 min","Documentaries, LGBTQ Movies"
80187722,"TV Show",FIGHTWORLD,"Padraic McKinley","Frank Grillo",,2018,2018,TV-MA,"1 Season",Docuseries
81021082,Movie,Kuntilanak,"Rizal Mantovani","Sandrinna M Skornicki, Aurélie Moeremans, Fero Walandouw, Andryan Bima, Ciara Nadine Brosnan, Ali Fikry, Adlu Fahrezy, Nena Rosier, Naufal Ho, Aqi Singgih",Indonesia,2018,2018,TV-14,"106 min","Horror Movies, International Movies"
80191047,Movie,"ReMastered: Who Shot the Sheriff","Kief Davidson",,"United States",2018,2018,TV-14,"57 min","Documentaries, Music & Musicals"
80201868,"TV Show","The Curious Creations of Christine McConnell",,"Christine McConnell, Colleen Smith, Adam Mayfield, Michael Oosterom, Drew Massey, Mick Ignis, Tim Lagasse, Dita von Teese, Steven M. Porter, Elko Weaver",,2018,2018,TV-PG,"1 Season","TV Comedies, TV Mysteries"
80189221,"TV Show","The Haunting of Hill House",,"Michiel Huisman, Carla Gugino, Timothy Hutton, Henry Thomas, Elizabeth Reaser, Oliver Jackson-Cohen, Kate Siegel, Victoria Pedretti, Lulu Wilson, Mckenna Grace, Paxton Singleton, Julian Hilliard, Violet McGraw","United States",2018,2018,TV-MA,"1 Season","TV Dramas, TV Horror, TV Mysteries"
80240972,Movie,"The Kindergarten Teacher","Sara Colangelo","Maggie Gyllenhaal, Parker Sevak, Gael García Bernal, Michael Chernus, Anna Baryshnikov, Rosa Salazar, Ajay Naidu","United States, Israel, United Kingdom, Canada",2018,2018,R,"97 min","Dramas, Independent Movies"
80103282,Movie,"Barakah Meets Barakah","Mahmoud Sabbagh","Hisham Fageeh, Fatima Al-Banawi, Sami Hifny, Khairia Nazmi, Abdulmajeed Al-Ruhaidi","Saudi Arabia",2017,2016,TV-14,"88 min","Comedies, International Movies, Romantic Movies"
80134526,Movie,"Bomb Scared","Borja Cobeaga","Javier Cámara, Julián López, Miren Ibarguren, Gorka Otxoa, Tina Sáinz, Ramón Barea",Spain,2017,2017,TV-MA,"89 min","Comedies, Independent Movies, International Movies"
80127559,Movie,"Justin Timberlake + the Tennessee Kids","Jonathan Demme","Justin Timberlake","United States",2016,2016,TV-PG,"90 min","Music & Musicals"
80005501,Movie,"Iron Man & Captain America: Heroes United","Leo Riley","Adrian Pasdar, Roger Craig Smith, Fred Tatasciore, David Kaye, Clancy Brown, Liam O'Brien, Robin Atkin Downes, Dee Bradley Baker","United States",2014,2014,PG,"71 min","Children & Family Movies, Sci-Fi & Fantasy"
81132441,Movie,"Bygones Be Bygones","Hakan Algül","Ata Demirer, Tuvana Türkay, Ülkü Duru, Salih Kalyon, Renan Bilek, Seda Güven, Toprak Sergen, Ali Yoğurtçuoğlu, Bedir Bedir, Gümeç Alpay Aslan",Turkey,2019,2017,TV-MA,"104 min","Comedies, International Movies, Romantic Movies"
81078819,Movie,"El Camino: A Breaking Bad Movie","Vince Gilligan","Aaron Paul","United States",2019,2019,TV-MA,"123 min","Dramas, Thrillers"
80223997,Movie,Fractured,"Brad Anderson","Sam Worthington, Lily Rabe, Stephen Tobolowsky, Adjoa Andoh, Lucy Capri, Lauren Cochrane, Shane Dean","United States",2019,2019,TV-MA,"100 min",Thrillers
81191666,Movie,"The Bling Lagosians","Bolanle Austen-Peters","Gbenga Titiloye, Elvina Ibru, Sharon Ooja, Osas Ighodaro Ajibade, Monalisa Chinda, Toyin Abraham, Bisola Aiyeola, Oladele Ogunlana, Jimmy Odukoya, Alex Ekubo",Nigeria,2019,2019,TV-14,"99 min","Dramas, International Movies"
81133621,Movie,"The Forest of Love","Sion Sono","Kippei Shiina, Shinnosuke Mitsushima, Kyooko Hinami, Eri Kamataki, Young Dais, Natsuki Kawamura, Yuzuka Nakaya, Dai Hasegawa, Chiho Fujii, Sei Matobu, Denden",Japan,2019,2019,TV-MA,"151 min","Dramas, International Movies, Thrillers"
81038598,Movie,"The Influence","Dennis Rovira van Boekholt","Manuela Vellés, Maggie Civantos, Alain Hernández, Claudia Placer, Daniela Rubio, Emma Suárez, Ramón Esquinas, Felipe García Vélez, Mariana Cordero","Spain, France",2019,2019,TV-MA,"102 min","Horror Movies, International Movies"
81016322,Movie,"Filosofi Kopi The Movie","Angga Dwimas Sasongko","Chicco Jerikho, Rio Dewanto, Julie Estelle, Jajang C. Noer, Slamet Rahardjo, Otig Pakis, Arash Buana, Hazel Raditya, Dimas Harya, Westny Dj",Indonesia,2018,2015,TV-PG,"118 min","Dramas, International Movies"
81015994,"TV Show","Ordinary Heroes",,"Giorgio Tirabassi, Marco Bocci, Cristiana Capotondi, Greta Scarano, Michela Cescon, Diane Fleri, Carlo Calderone, Claudio Gioè, Romina Mondello, Orlando Cinque, Luigi Maria Burruano, Riccardo Scamarcio, Lorenza Indovina, Ivana Lotito, Pierfrancesco Poggi, Marco Leonardi, Anna Ferruzzo, Peppino Mazzotta, Giorgio Marchesi",,2018,2018,TV-MA,"1 Season","Crime TV Shows, International TV Shows, TV Dramas"
80198288,"TV Show","Salt Fat Acid Heat",,"Samin Nosrat",,2018,2018,TV-PG,"1 Season",Docuseries
80147323,Movie,اشتباك,"Mohamed Diab","Nelly Karim, Hany Adel, Tarek Abdel Aziz, Ahmed Malek, Ahmed Dash, Husni Sheta, Aly Eltayeb, Amr El Kady, Mohamed Abd El Azim, Gameel Barsoum, Ashraf Hamdy","Egypt, France",2018,2016,TV-14,"98 min","Dramas, Independent Movies, International Movies"
81172568,"TV Show","Beyblade Burst Turbo",,"Laura Stahl, Billy Kametz, Derek Stephen Prince, Kyle McCarley, Brandon Winckler, Kimlinh Tran",,2019,2018,TV-Y7,"1 Season","Anime Series, Kids' TV"
81171871,Movie,"GEN HOSHINO STADIUM TOUR “POP VIRUS”","Naoto Amazutsumi","Gen Hoshino",,2019,2019,TV-PG,"154 min","International Movies, Music & Musicals"
81019771,"TV Show","Ultramarine Magmell",,"Kengo Kawanishi, M・A・O, Toshiyuki Morikawa, Hibiku Yamamura, Satoshi Mikami, Koji Yusa, Hiroshi Yanaka, Shiro Saito, Keiichi Sonobe",Japan,2019,2019,TV-14,"1 Season","Anime Series, International TV Shows"
80210932,Movie,22-Jul,"Paul Greengrass","Anders Danielsen Lie, Jon Øigarden, Jonas Strand Gravli, Ola G. Furuseth, Maria Bock, Thorbjørn Harr, Jaden Smith","Norway, Iceland, United States",2018,2018,R,"144 min","Dramas, Thrillers"
81003880,"TV Show","Blood Pact",,"Guilherme Fontes, Ravel Cabral, Jonathan Haagensen, André Ramiro, Adriano Garib, Mel Lisboa, Cristina Lago",Brazil,2018,2018,TV-MA,"1 Season","Crime TV Shows, International TV Shows, TV Dramas"
81015317,Movie,"Tales From the Hood 2","Rusty Cundieff, Darin Scott","Keith David, Bryan Batt, Alexandria Deberry, Bill Martin Williams, Martin Bats Bradford, Kendrick Cross, Jasmine Akakpo, Kedrick Brown","United States",2018,2018,R,"110 min","Cult Movies, Horror Movies, Independent Movies"
80205204,Movie,"Christina P: Mother Inferior","Jay Karas","Christina Pazsitzky","United States",2017,2017,TV-MA,"59 min","Stand-Up Comedy"
70245168,"TV Show","Nature's Great Events (2009)",,"David Attenborough","United States, United Kingdom",2015,2009,TV-PG,"1 Season","British TV Shows, Docuseries, Science & Nature TV"
70235731,"TV Show","The Blue Planet: A Natural History of the Oceans","Alastair Fothergill","David Attenborough","United Kingdom",2015,2001,TV-G,"1 Season","British TV Shows, Docuseries, International TV Shows"
80003481,Movie,"Chelsea Handler: Uganda Be Kidding Me Live","James Yukich","Chelsea Handler","United States",2014,2014,TV-MA,"71 min","Stand-Up Comedy"
81168338,Movie,"300 Miles to Heaven","Maciej Dejczer","Krzysztof Stroiński, Andrzej Mellin, Adrianna Biedrzyńska, Adrianna Biedrzyńska, Rafał Zimowski, Kama Kowalewska, Wiesław Komasa, Aleksander Bednarz, Jadwiga Jankowska-Cieslak, Wojciech Klata","Denmark, France, Poland",2019,1989,TV-14,"93 min","Dramas, International Movies"
81103033,Movie,A.M.I.,"Rusty Nixon","Debs Howard, Philip Granger, Sam Robert Muik, Havana Guppy, Bonnie Hay, Veronica Hampson, Lori Triolo, Andrew Coghlan, Laura Mitchell, Elinet Louicius",Canada,2019,2019,TV-MA,"77 min","Horror Movies"
60002273,Movie,"Along Came a Spider","Lee Tamahori","Morgan Freeman, Monica Potter, Michael Wincott, Dylan Baker, Mika Boorem, Anton Yelchin, Kim Hawthorne, Jay O. Sanders, Billy Burke, Michael Moriarty, Penelope Ann Miller","United States, Germany, Canada",2019,2001,R,"103 min",Thrillers
70297962,Movie,"Alpha and Omega 2: A Howl-iday Adventure","Richard Rich","Ben Diskin, Kate Higgins, Blackie Rose, Lindsay Torrance, Liza West, Tracy Pfau, Bill Lader, Meryl Leigh, Shaun Gerardo","United States",2019,2013,TV-G,"45 min","Children & Family Movies"
269880,Movie,"Bad Boys","Michael Bay","Will Smith, Martin Lawrence, Téa Leoni, Tchéky Karyo, Theresa Randle, Joe Pantoliano, Emmanuel Xuereb, Michael Imperioli, Nestor Serrano, Julio Oscar Mechoso","United States",2019,1995,R,"119 min","Action & Adventure, Comedies"
60029167,Movie,"Bad Boys II","Michael Bay","Will Smith, Martin Lawrence, Jordi Mollà, Gabrielle Union, Peter Stormare, Theresa Randle, Joe Pantoliano, Michael Shannon, Jon Seda, Yul Vazquez","United States",2019,2003,R,"147 min","Action & Adventure, Comedies"
60020891,Movie,Blow,"Ted Demme","Johnny Depp, Penélope Cruz, Franka Potente, Rachel Griffiths, Paul Reubens, Jordi Mollà, Cliff Curtis, Miguel Sandoval, Ethan Suplee, Ray Liotta","United States",2019,2001,R,"123 min",Dramas
347365,Movie,Candyman,"Bernard Rose","Virginia Madsen, Tony Todd, Xander Berkeley, Kasi Lemmons, Vanessa Williams, DeJuan Guy, Michael Culkin, Stanley DeSantis","United States, United Kingdom",2019,1992,R,"99 min","Cult Movies, Horror Movies"
60003242,Movie,"Charlie's Angels",McG,"Cameron Diaz, Drew Barrymore, Lucy Liu, Bill Murray, Sam Rockwell, Kelly Lynch, Tim Curry, Crispin Glover, Matt LeBlanc, LL Cool J, Tom Green, Luke Wilson","United States, Germany",2019,2000,PG-13,"98 min","Action & Adventure, Comedies"
60027726,Movie,"Charlie's Angels: Full Throttle",McG,"Cameron Diaz, Drew Barrymore, Lucy Liu, Bernie Mac, Crispin Glover, Justin Theroux, Robert Patrick, Demi Moore, Rodrigo Santoro, Shia LaBeouf, Matt LeBlanc, Luke Wilson, John Cleese","United States",2019,2003,PG-13,"106 min","Action & Adventure, Comedies"
81166946,"TV Show","Cheese in the Trap","Lee Yoon-jung","Park Hae-Jin, Kim Go-eun, Seo Kang-jun, Lee Sung-kyoung, Nam Joo-hyuk, Park Min-ji, Hwang Seog-jeong, Son Byung-ho, Ahn Kil-kang","South Korea",2019,2016,TV-14,"1 Season","International TV Shows, Korean TV Shows, Romantic TV Shows"
81167065,"TV Show","Chicago Typewriter",,"Yoo Ah-in, Im Soo-jung, Ko Kyoung-pyo, Kwak Si-yang, Jo Woo-jin, Yang Jin-sung, Jeon Soo-kyeong, Ji Dae-han, Chun Ho-jin","South Korea",2019,2017,TV-14,"1 Season","International TV Shows, Korean TV Shows, Romantic TV Shows"
81113888,"TV Show","College Romance",,"Manjot Singh, Apoorva Arora, Keshav Sadhna, Shreya Mehta, Hira Ashar, Gagan Arora",India,2019,2018,TV-MA,"1 Season","International TV Shows, Romantic TV Shows, TV Comedies"
70023961,Movie,Crash,"Paul Haggis","Sandra Bullock, Don Cheadle, Matt Dillon, Jennifer Esposito, William Fichtner, Brendan Fraser, Terrence Howard, Ludacris, Thandie Newton, Ryan Phillippe, Larenz Tate, Nona Gaye, Michael Peña","United States, Germany",2019,2004,R,"112 min","Dramas, Independent Movies"
60027716,Movie,"Dumb and Dumberer: When Harry Met Lloyd","Troy Miller","Eric Christian Olsen, Derek Richardson, Rachel Nichols, Cheri Oteri, Luis Guzmán, Elden Henson, William Lee Scott, Mimi Rogers, Eugene Levy","United States",2019,2003,PG-13,"85 min",Comedies
