show_id,type,title,director,cast,country,year_added,release_year,rating,duration,category
80220650,"TV Show","YG Future Strategy Office",,"Seungri, Yoo Byung Jae, Lee Jai-jin, Jinu, Son Se-bin, Kim Ga-eun, Park Choong-hwan, Baek Yeong-gwang, Choi Sin-deuk","South Korea",2018,2018,TV-MA,"1 Season","International TV Shows, Korean TV Shows, TV Comedies"
80164032,Movie,"A Plastic Ocean",,"Tanya Streeter","United Kingdom, Hong Kong",2019,2016,TV-PG,"100 min",Documentaries
81158574,Movie,"Brother in Love","Onur Bilgetay","Cem Gelinoğlu, Melis Babadag, Ege Kökenli, Müfit Kayacan, Lale Başar, Ali Erkazan, Özlem Çakar, Selen Domaç, Ferdi Sancar, Güven Hokna",Turkey,2019,2019,TV-14,"110 min","Comedies, International Movies, Romantic Movies"
80237905,Movie,"In the Tall Grass","Vincenzo Natali","Patrick Wilson, Laysla De Oliveira, Avery Whitted, Harrison Gilbertson, Rachel Wilson, Will Buie Jr.",Canada,2019,2019,TV-MA,"102 min","Horror Movies, Thrillers"
81132440,Movie,"Kids on the Block","Tugçe Soysop","Selim Bayraktar, Berat Efe Parlar, Esat Polat Güler, Eda Döğer, Dora Dalgıç, Taha Sönmezisik, Zeynep Ilgin Çelik, Arda Taşarcan, Alperen Efe Esmer, İlknur Külahlıoglu, İkra Külahlıoğlu",Turkey,2019,2019,TV-PG,"102 min","Children & Family Movies, Comedies"
80117803,"TV Show","Raising Dion",,"Alisha Wainwright, Ja'Siah Young, Jason Ritter, Michael B. Jordan, Jazmyn Simon, Ali Ahn, Sammi Haney","United States",2019,2019,TV-PG,"1 Season","Kids' TV, TV Action & Adventure, TV Dramas"
81021243,Movie,"Super Monsters: Vida's First Halloween","Jacob Joice, Steve Ball","Gigi Saul Guerrero, Elyse Maloway, Vincent Tong, Erin Mathews, Andrea Libman, Alessandro Juliani, Nicole Anthony, Diana Kaarina, Ian James Corlett, Britt McKillip, Kathleen Barr","United States",2019,2019,TV-Y,"24 min","Children & Family Movies"
81004460,Movie,Compulsion,"Craig Goodwill","Analeigh Tipton, Jakob Cedergren, Marta Gastini, Jan Bijvoet, Anita Kravos, Valentin Merlet","United Kingdom, Canada, Italy",2018,2016,TV-MA,"84 min","Dramas, Thrillers"
81016330,Movie,"The Dreamer","Riri Riza","Vikri Septiawan, Rendy Ahmad, Azwir Fitrianto, Maudy Ayunda",Indonesia,2018,2009,TV-PG,"121 min","Dramas, International Movies"
70105130,Movie,"The Haunting of Molly Hartley","Mickey Liddell","Haley Bennett, Jake Weber, Chace Crawford, Shannon Woodward, Shanna Collins, AnnaLynne McCord, Marin Hinkle, Nina Siemaszko, Josh Stewart, Jessica Lowndes, Randy Wayne","United States",2018,2008,PG-13,"85 min","Horror Movies, Thrillers"
81010662,"TV Show","Violet Evergarden: Special",,"Yui Ishikawa, Takehito Koyasu, Daisuke Namikawa, Aya Endo, Kouki Uchiyama, Minori Chihara, Haruka Tomatsu, Yoko Hikasa",Japan,2018,2018,TV-PG,"1 Season","Anime Series, International TV Shows, Romantic TV Shows"
80141858,Movie,"LEGO Jurassic World: The Indominus Escape","Michael D. Black","A.J. LoCascio, Sendhil Ramamurthy, Fred Tatasciore, Jake Johnson, Lauren Lapkus, Zachary Levi, BD Wong, David Gunning","United States",2016,2016,TV-Y7,"25 min","Children & Family Movies, Comedies"
81084225,Movie,"Grego Rossello: Disculpe las molestias","Juani Libonatti","Grego Rossello",Argentina,2019,2019,TV-MA,"65 min","Stand-Up Comedy"
80203920,"TV Show","Nowhere Man","DJ Chen","Alyssa Chia, Mavis Fan, Joseph Chang, Wang Po-chieh, Jeremiah Zhang, Chou Min-fu, Greg Hsu, Kuo Tze-cheng, Shen Hai-jung, Lu Yi-long",Taiwan,2019,2019,TV-MA,"1 Season","Crime TV Shows, International TV Shows, TV Action & Adventure"
80242051,"TV Show","Sleepless Society: Bedtime Wishes",,"Shahkrit Yamnarm, Savika Chaiyadej, Supoj Chancharoen, Pairoj Sangwariboot, Suchao Pongwilai, Nataya Chanrung, Papangkorn Lerkchaleampote, Suchada Tongam, Sasin Chow",,2019,2019,TV-MA,"1 Season","Crime TV Shows, International TV Shows, TV Dramas"
80199806,Movie,"Gun City","Dani de la Torre","Luis Tosar, Michelle Jenner, Vicente Romero, Manolo Solo, Paco Tous, Adriana Torrebejano, Pep Tosar, Jaime Lorente, Ernesto Alterio, Fernando Cayo","Spain, France",2018,2018,TV-MA,"126 min","Dramas, International Movies, Thrillers"
80084834,Movie,"Heneral Luna","Jerrold Tarog","John Arcilla, Mon Confiado, Arron Villaflor, Joem Bascon, Archie Alemania, Art Acuña, Alex Medina, Nonie Buencamino, Lorenz Martinez, Jeffrey Quizon, Alvin Anson, Mylene Dizon, Bing Pimentel, Leo Martinez, Ketchup Eusebio, Ronnie Lazaro, Paulo Avelino",Philippines,2018,2015,R,"118 min","Dramas, International Movies"
80208273,Movie,"Judah Friedlander: America Is the Greatest Country in the United States","Judah Friedlander","Judah Friedlander","United States",2017,2017,TV-MA,"84 min","Stand-Up Comedy"
80145699,Movie,"The B-Side: Elsa Dorfman's Portrait Photography","Errol Morris","Elsa Dorfman","United States",2017,2016,TV-MA,"76 min",Documentaries
80204927,"TV Show","Zumbo's Just Desserts",,"Adriano Zumbo, Rachel Khoo",Australia,2017,2016,TV-14,"1 Season","International TV Shows, Reality TV"
70266684,Movie,Kristy,"Oliver Blackburn","Haley Bennett, Ashley Greene, Erica Ash, Lucas Till, Chris Coy, Al Vicente, Wayne Pére, Jon Arthur, Mike Seal","United States",2015,2013,NR,"85 min","Horror Movies"
81166978,"TV Show","Bring It On, Ghost","Park Joon-hwa","Taecyeon, Kim So-hyun, Kwon Yul, Kim Sang-ho, Kang Ki-young, Lee Da-wit, Kim Min-sang, Yun Seo-hyun","South Korea",2019,2016,TV-14,"1 Season","International TV Shows, Korean TV Shows, Romantic TV Shows"
81177371,Movie,"Mehandi Circus","Saravana Rajendran","Madhampatti Rangaraj, Shweta Tripathi, Vela Ramamoorthy, Ankur Vikal, G. Marimuthu, Sunny Charles",India,2019,2019,TV-14,"126 min","Dramas, International Movies, Romantic Movies"
81167029,"TV Show","Tomorrow with You",,"Shin Mina, Lee Je-hoon, Kim Ye-won, Cho Han-cheul, Baek Hyeon-jin, Kang Ki-doong, Park Joo-hee, Oh Gwang-rok","South Korea",2019,2017,TV-14,"1 Season","International TV Shows, Korean TV Shows, Romantic TV Shows"
81142594,"TV Show",Tunnel,,"Todsapol Maisuk, Johnny Hao, Morakot Liu, Pemy Peramin Thabkaew, Phenphet Phenkul, Sumet Ong-Art, Amarin Nitipon, Tor Techathuwanan, Komsan Kajonpaisansuk",,2019,2019,TV-MA,"1 Season","Crime TV Shows, International TV Shows, TV Dramas"
70067230,Movie,"My Brother ... Nikhil",Onir,"Juhi Chawla, Sanjay Suri, Victor Banerjee, Lillete Dubey, Purab Kohli, Dipannita Sharma, Gautam Kapoor",India,2018,2005,TV-PG,"116 min","Dramas, Independent Movies, International Movies"
80207446,Movie,Shorgul,"Jitendra Tiwari, Pranav Singh","Ashutosh Rana, Jimmy Shergill, Suha Gezen, Sanjay Suri, Narendra Jha, Hiten Tejwani, Eijaz Khan, Aniruddha Dave",India,2018,2016,TV-14,"122 min","Dramas, International Movies"
80207447,Movie,Siddhant,"Vivek Wagh","Vikram Gokhale, Swati Chitnis, Kishore Kadam, Ganesh Yadav, Sarang Sathaye, Archit Deodhar, Madhavi Soman, Neha Mahajan",India,2018,2014,TV-G,"105 min","Dramas, Independent Movies, International Movies"
80987753,"TV Show","The Degenerates",,"Big Jay Oakerson, Brad Williams, Yamaneika Saunders, Liza  Treyger, Joey Diaz, Christina Pazsitzky",,2018,2018,TV-MA,"1 Season","Stand-Up Comedy & Talk Shows, TV Comedies"
81016324,Movie,"The Jungle School","Riri Riza","Prisia Nasution, Nyungsang Bungo, Rukman Rosadi, Nadhira Suryadi, Ines Somellera",Indonesia,2018,2013,TV-PG,"90 min","Dramas, International Movies"
80192097,Movie,SPF-18,"Alex Israel","Carson Meyer, Noah Centineo, Bianca Santos, Jackson White, Sean Russel Herman, Rosanna Arquette, Molly Ringwald, Pamela Anderson, Keanu Reeves, Goldie Hawn","United States",2017,2017,PG-13,"75 min","Dramas, Romantic Movies, Sports Movies"
70185045,Movie,"Forks Over Knives","Lee Fulkerson",,"United States",2019,2011,PG,"96 min",Documentaries
80217066,"TV Show","Seis Manos",,"Aislinn Derbez, Mike Colter, Jonny Cruz, Angélica Vale, Vic Chao, Danny Trejo","United States",2019,2019,TV-MA,"1 Season","Anime Series, Crime TV Shows"
70002129,Movie,"Benji's Very Own Christmas Story","Joe Camp","Ron Moody, Patsy Garrett, Cynthia Smith","United States",2018,1978,TV-G,"25 min","Children & Family Movies"
80191963,Movie,"The Black Prince","Kavi Raz","Satinder Sartaaj, Shabana Azmi, Jason Flemyng, Amanda Root, Rup Magon, Sophie Stevens, Keith Duffy, David Essex, Leanne Joyce, Ranjit Singh Shubh","United Kingdom, India, United States",2018,2017,PG-13,"121 min","Dramas, International Movies"
80218099,Movie,"Truth or Dare","Nick Simon","Cassandra Scerbo, Brytni Sarpy, Mason Dye, Harvey Guillen, Luke Baines, Ricardo Hoyos, Alexxis Lemire, Christina Masterson, Heather Langenkamp","United States",2018,2017,TV-MA,"88 min","Horror Movies"
80199767,Movie,"Cult of Chucky","Don Mancini","Fiona Dourif, Michael Therriault, Adam Hurtig, Alex Vincent, Jennifer Tilly, Brad Dourif, Summer H. Howell, Grace Lynn Kung, Elisabeth Rosen, Zak Santiago, Ali Tataryn","United States",2017,2017,R,"90 min","Horror Movies"
80191665,Movie,"Rodney Carrington: Here Comes the Truth","Brandon Jones","Rodney Carrington","United States",2017,2017,TV-MA,"66 min","Stand-Up Comedy"
80161921,Movie,Security,"Alain Desrochers","Antonio Banderas, Ben Kingsley, Liam McIntyre, Cung Le, Katherine de la Rocha, Chad Lindberg, Jiro Wang, Gabriella Wright, Shari Watson, John Strong","United States",2017,2017,R,"92 min","Action & Adventure"
81148672,Movie,"Arsenio Hall: Smart & Classy","Brian Volk-Weiss","Arsenio Hall","United States",2019,2019,TV-MA,"63 min","Stand-Up Comedy"
81169914,"TV Show","Shine On with Reese",,"Reese Witherspoon","United States",2019,2018,TV-14,"1 Season",Docuseries
81211714,Movie,"The Road to El Camino: Behind the Scenes of El Camino: A Breaking Bad Movie",,,"United States",2019,2019,TV-14,"14 min","Documentaries, International Movies"
80224362,Movie,Kings,"Deniz Gamze Ergüven","Halle Berry, Daniel Craig, Lamar Johnson, Kaalan Walker, Rachel Hilson, Issac Ryan Brown, Callan Farris, Serenity Reign Brown, Reece Cody, Aiden Akpan","France, Belgium, China, United States",2018,2017,R,"87 min",Dramas
80092857,Movie,"Pup Star","Robert Vince","Makenzie Moss, Jed Rees, David DeLuise, Carla Jimenez, Tom Everett Scott, Diedrich Bader, George Newbern, Bonnie Somerville, John Ratzenberger",Canada,2016,2016,G,"92 min","Children & Family Movies, Comedies"
80244679,Movie,"A 3 Minute Hug","Everardo González",,"Mexico, United States",2019,2019,TV-PG,"28 min","Documentaries, International Movies"
81110394,Movie,"Little Miss Sumo","Matt Kay","Hiyori Kon","United Kingdom",2019,2018,TV-G,"20 min","Documentaries, International Movies, Sports Movies"
80067754,Movie,Equals,"Drake Doremus","Nicholas Hoult, Kristen Stewart, Jacki Weaver, Guy Pearce, Rebecca Hazlewood, Scott Lawrence, Kai Lennox, Rizwan Manji","United States, Indonesia",2018,2015,PG-13,"102 min","Dramas, Romantic Movies, Sci-Fi & Fantasy"
80189954,Movie,"Pup Star: Better 2Gether","Robert Vince","Kaitlyn Maher, Obba Babatundé, Lombardo Boyar, Molly Burnett, Chris Coppola, Reggie De Leon, David DeLuise, Matty Finochio, Josh Flitter, Benjamin Flores Jr.",Canada,2017,2017,PG,"93 min","Children & Family Movies, Comedies"
80094648,Movie,"I Am the Pretty Thing That Lives in the House","Osgood Perkins","Ruth Wilson, Bob Balaban, Lucy Boynton, Paula Prentiss","Canada, United States",2016,2016,TV-14,"89 min","Horror Movies, International Movies, Thrillers"
80066073,Movie,"Into the Inferno","Werner Herzog","Werner Herzog","United Kingdom, Germany, Canada",2016,2016,TV-PG,"107 min",Documentaries
80123740,Movie,"The African Doctor","Julien Rambaldi","Marc Zinga, Aïssa Maïga, Bayron Lebli, Médina Diarra, Rufus, Jonathan Lambert, Jean-Benoît Ugeux",France,2016,2016,TV-PG,"94 min","Comedies, Dramas, International Movies"
80123741,Movie,"They Are Everywhere","Yvan Attal","Yvan Attal, Benoît Poelvoorde, Charlotte Gainsbourg, Valérie Bonneton, Dany Boon, Grégory Gadebois, Denis Podalydès, François Damiens, Yamée Couture, Freya Mavor, Rivka Michaeli","France, Belgium",2016,2016,TV-MA,"110 min","Comedies, International Movies"
80094260,"TV Show","Trailer Park Boys: Out of the Park: Europe",,"Mike Smith, John Paul Tremblay, Robb Wells",Canada,2016,2016,TV-MA,"1 Season","International TV Shows, TV Comedies"
80123742,Movie,"West Coast","Benjamin Weill","Devi Couzigou, Mathis Crusson, Victor Le Blond, Sullivan Loyez, Pierre-François Martin-Laval, Hugo Chalan-Marchio",France,2016,2016,TV-MA,"81 min","Comedies, Dramas, International Movies"
81197399,"TV Show","Wait, My Youth",,"Zhao Yiqin, Li Jiaqi, Li Geyang, Xu Mengyuan, Wu Shuangyi, Dong Yanlei, Vincent Wei",,2019,2019,TV-PG,"1 Season","International TV Shows, Romantic TV Shows, Teen TV Shows"
81000863,Movie,"14 Cameras","Scott Hussion, Seth Fuller","Neville Archambault, Amber Midthunder, Brytnee Ratledge, Hank Rogerson, Chelsea Edmundson, John-Paul Howard, Lora Martinez-Cunningham, Brianne Moncrief","United States",2018,2018,TV-MA,"89 min","Horror Movies, Thrillers"
70082255,Movie,"Dragon Tiger Gate","Wilson Yip","Donnie Yen, Nicholas Tse, Shawn Yue, Dong Jie, Li Xiaoran, Yuen Wah, Chen Kuan Tai, Xing Yu, Vincent Sze, Tommy Yuen","Hong Kong, China",2018,2006,TV-MA,"94 min","Action & Adventure, International Movies"
80197912,"TV Show","Beyond Stranger Things",,"Jim Rash, Matt Duffer, Ross Duffer, Shawn Levy, David Harbour, Finn Wolfhard, Millie Bobby Brown, Gaten Matarazzo, Caleb McLaughlin, Natalia Dyer, Charlie Heaton, Noah Schnapp, Joe Keery, Dacre Montgomery, Sadie Sink, Paul Reiser, Sean Astin, Randy Havens, Brett Gelman, Linnea Berthelsen","United States",2017,2017,TV-14,"1 Season","Stand-Up Comedy & Talk Shows, TV Mysteries, TV Sci-Fi & Fantasy"
80117454,Movie,"Joan Didion: The Center Will Not Hold","Griffin Dunne","Joan Didion","United States",2017,2017,TV-14,"98 min",Documentaries
80095197,Movie,"7 años","Roger Gual","Paco León, Juana Acosta, Juan Pablo Raba, Alex Brendemühl, Manuel Morón",Spain,2016,2016,TV-MA,"77 min","Dramas, International Movies"
80045783,Movie,"Manson Family Vacation","J. Davis","Jay Duplass, Linas Phillips, Leonora Pitts, Adam Chernick, Davie-Blue, Suzanne Ford, Tobin Bell","United States",2015,2015,NR,"85 min","Comedies, Dramas, Independent Movies"
81185502,"TV Show","A Little Thing Called First Love",,"Lai Kuan-lin, Zhao Jinmai, Wang Runze, Chai Wei, Wang Bowen",China,2019,2019,TV-G,"1 Season","International TV Shows, Romantic TV Shows, Teen TV Shows"
81123469,Movie,"The Last Whistle","Rob Smat","Brad Leland, Jim O'Heir, Deanne Lauvin, Les Miles, Eric Nelsen, Fred Tolliver Jr, Tyler Perez, Sainty Nelsen","United States",2019,2019,PG,"88 min","Dramas, Sports Movies"
80211622,Movie,"Been So Long","Tinge Krishnan","Michaela Coel, Arinzé Kene, George MacKay, Ashley Thomas, Joe Dempsie, Ronke Adekoluejo, Luke Norris, Mya Lewis",,2018,2018,TV-MA,"100 min","Dramas, International Movies, Music & Musicals"
80990221,Movie,Dovlatov,"Aleksey German","Milan Maric, Danila Kozlovsky, Helena Sujecka, Artur Beschastny, Anton Shagin, Svetlana Khodchenkova, Elena Lyadova, Piotr Gasowski, Eva Gerr, Hanna Sleszynska","Russia, Poland, Serbia",2018,2018,PG-13,"126 min","Dramas, International Movies"
80202352,Movie,Incoming,"Eric Zaragosa","Scott Adkins, Aaron McCusker, Vahldin Prelic, Lukas Loughran, Michelle Lehane, Alaa Seif, Milan Kovacevic, Arkie Reece, Vladimir Alenikov, Dominic Power","Serbia, United States",2018,2019,TV-MA,"89 min","Action & Adventure, Sci-Fi & Fantasy"
80235268,Movie,Jefe,"Sergio Barrejón","Luis Callejo, Juana Acosta, Carlo D'Ursi, Josean Bengoetxea, Bárbara Santa-Cruz, Maica Barroso, Adam Jezierski, Sergio Quintana","Spain, Portugal",2018,2018,TV-MA,"90 min","Comedies, Dramas, International Movies"
80992500,Movie,"Santo Cachón",,,Colombia,2018,2018,TV-14,"87 min","Comedies, International Movies, Romantic Movies"
80241061,Movie,Shirkers,"Sandi Tan",,"United States, United Kingdom",2018,2018,TV-14,"97 min",Documentaries
80185048,"TV Show","Terrorism Close Calls",,,"United States, Czech Republic",2018,2018,TV-MA,"1 Season","Crime TV Shows, Docuseries, International TV Shows"
81025088,Movie,"W/O Ram","Vijay Yelakanti","Lakshmi Manchu, Aadarsh Balakrishna, Priyadarshi Pullikonda, Samrat Reddy, Shrikanth Iyyangar, Shrusti Dange",India,2018,2018,TV-MA,"115 min","Dramas, International Movies, Thrillers"
80173479,Movie,"Strange Weather","Katherine Dieckmann","Holly Hunter, Carrie Coon, Kim Coates, Shane Jacobsen, Andrene Ward-Hammond, Allene Quincy, Glenne Headly","United States",2017,2016,R,"91 min","Dramas, Independent Movies"
80081372,Movie,"A Tale of Love and Darkness","Natalie Portman","Natalie Portman, Gilad Kahana, Amir Tessler, Moni Moshonov, Ohad Knoller, Makram Khoury, Neta Riskin, Alexander Peleg, Rotem Keinan, Tomer Kapon","Israel, United States",2019,2015,PG-13,"98 min","Dramas, International Movies"
81136744,Movie,Assimilate,"John Murlowski","Joel Courtney, Calum Worthy, Andi Matichak, Katherine McNamara, Cam Gigandet, Mason McNulty, Terry Dale Parks, Vito Viscuso, Jennifer Pierce Mathus, Kevin Remington","United States",2019,2019,TV-14,"94 min","Horror Movies, Sci-Fi & Fantasy, Thrillers"
80221210,"TV Show",Brotherhood,,"Naruna Costa, Seu Jorge, Hermila Guedes, Lee Taylor, Danilo Grangheia, Wesley Guimarães, Pedro Wagner",Brazil,2019,2019,TV-MA,"1 Season","Crime TV Shows, International TV Shows, TV Dramas"
81132444,Movie,Consequences ,"Ozan Açıktan","Nehir Erdoğan, Tardu Flordun, İlker Kaleli, Serkan Keskin, Esra Bezen Bilgin, Aytaç Uşun, Cem Özeren, Caner Arçkan",Turkey,2019,2014,TV-MA,"106 min","Dramas, International Movies, Thrillers"
80182014,Movie,"Dolemite Is My Name","Craig Brewer","Eddie Murphy, Wesley Snipes, Keegan-Michael Key, Mike Epps, Craig Robinson, Tituss Burgess, Da'Vine Joy Randolph, Kodi Smit-McPhee","United States",2019,2019,R,"118 min","Comedies, Dramas"
81010786,"TV Show","Drug Squad: Costa del Sol",,"Hugo Silva, Álvaro Cervantes, Miki Esparbé, Jesús Castro, Sara Sálamo, Jorge Usón, Cayetana Cabezas, Pablo Béjar, Marco Cáceres, Olivia Delcán, Jorge Suquet, Daniel Holguín, Joaquín Galletero, Carolina Yuste, Ana Fernández",Spain,2019,2019,TV-MA,"1 Season","Crime TV Shows, International TV Shows, Spanish-Language TV Shows"
81078456,Movie,"It Takes a Lunatic","Billy Lyons",,"United States, United Kingdom, Germany",2019,2019,TV-MA,"127 min",Documentaries
81105406,"TV Show","Monzón: A Knockout Blow",,"Jorge Román, Mauricio Paniagua, Carla Quevedo, Paloma Ker, Soledad Silveyra, Diego Cremonesi, Florencia Raggi, Gustavo Garzón, Yayo Guridi, Fabián Arenillas, Nacho Gadano, Belén Chavanne",Argentina,2019,2018,TV-MA,"1 Season","Crime TV Shows, International TV Shows, Spanish-Language TV Shows"
81121023,Movie,"My Next Guest with David Letterman and Shah Rukh Khan","Michael Steed","Shah Rukh Khan, David Letterman",,2019,2019,TV-PG,"61 min","International Movies"
81061828,"TV Show","Nailed It! France",,"Artus, Noémie Honiat",France,2019,2019,TV-14,"1 Season","International TV Shows, Reality TV"
81062582,"TV Show","Nailed It! Spain",,"La Terremoto de Alcorcón, Christian Escribà",Spain,2019,2019,TV-PG,"1 Season","International TV Shows, Reality TV, Spanish-Language TV Shows"
81017316,"TV Show","Prank Encounters",,"Gaten Matarazzo","United States",2019,2019,TV-MA,"1 Season","Reality TV, TV Comedies, TV Horror"
81018455,Movie,Rattlesnake,"Zak Hilditch","Carmen Ejogo, Theo Rossi, Emma Greenwell, Apollonia Pratt, Debrianna Mansini, Bruce Davis","United States",2019,2019,TV-MA,"86 min","Horror Movies, Independent Movies, Thrillers"
81110383,Movie,"The Awakening of Motti Wolkenbruch","Michael Steiner","Inge Maux, Noémie Schmidt, Joel Basman, Sunnyi Melles, Udo Samel, Rachel Braunschweig, Oriana Schrage, Meytal Gal",Switzerland,2019,2018,TV-MA,"94 min","Comedies, Dramas, International Movies"
81200228,"TV Show","The Untamed",,"Sean Xiao, Wang Yibo, Zoey Meng, Xuan Lu, Yu Bin, Wang Zhuocheng, Liu Haikuan, Zhu Zanjin, Wang Haoxuan, Ji Li",China,2019,2019,TV-14,"1 Season","International TV Shows, TV Action & Adventure, TV Mysteries"
70218316,"TV Show","DreamWorks Spooky Stories",,"Antonio Banderas, Hugh Laurie, Mike Myers, Reese Witherspoon, Seth Rogen, Kristen Schaal, Dean Edwards","United States",2018,2009,TV-PG,"1 Season","Kids' TV, TV Comedies"
80995073,"TV Show","Queens vs. Kings",,"Varun Thakur, Anu Menon, Rahul Subramanian, Siddharth Dudeja, Supriya Joshi, Utsav Chakraborty, Saadiya Ali, Kavya Bector, Kumar Varun",,2018,2018,TV-14,"1 Season","Stand-Up Comedy & Talk Shows, TV Comedies"
81018183,Movie,"Ronnie Coleman: The King","Vlad Yudin","Ronnie Coleman","United States",2018,2018,TV-14,"93 min",Documentaries
80219941,Movie,"Meet the Trumps: From Immigrant to President","Paul Berczeller, Mark Radice",,"United Kingdom",2017,2017,TV-14,"48 min",Documentaries
80064515,Movie,"The Hateful Eight","Quentin Tarantino","Samuel L. Jackson, Kurt Russell, Jennifer Jason Leigh, Walton Goggins, Demián Bichir, Tim Roth, Michael Madsen, Bruce Dern, James Parks, Dana Gourrier, Channing Tatum, Zoë Bell","United States",2017,2015,R,"168 min","Action & Adventure, Thrillers"
80062011,Movie,"Walt Disney Animation Studios Short Films Collection","Chris Buck, Jennifer Lee, Patrick Osborne, Lauren MacMullan, John Kahrs, Nathan Greno, Byron Howard, Stevie Wermers, Dean Wellins, Kevin Deters, Roger Allers, Mike Gabriel, Mark Henn","Kristen Bell, Josh Gad, Jonathan Groff, Idina Menzel, Geoffrey Jones, Alfre Woodard, Carrie Harrington, Tim Hodge, David Murray, Sarah Chalke, Dave Foley, Derek Richardson, Betty White, Zachary Levi, Mandy Moore","United States",2015,2015,TV-G,"90 min","Children & Family Movies"
80197462,"TV Show",Daybreak,,"Colin Ford, Alyvia Alyn Lind, Sophie Simnett, Austin Crute, Cody Kearsley, Jeanté Godlock, Gregory Kasyan, Krysta Rodriguez, Matthew Broderick","United States",2019,2019,TV-MA,"1 Season","TV Action & Adventure, TV Comedies, TV Horror"
81034741,Movie,"Echo in the Canyon","Andrew Slater","Jakob Dylan, Ringo Starr, Michelle Phillips, Stephen Stills, Regina Spektor, Beck, Eric Clapton, Tom Petty, Jackson Browne, Norah Jones","United States",2019,2019,PG-13,"82 min","Documentaries, Music & Musicals"
81075461,Movie,"Revenge of the Pontianak","Glen Goei, Gavin Yap","Nur Fazura, Remy Ishak, Hisyam Hamid, Shenty Feliziana, Nam Ron, Tony Eusoff, Wan Hanafi Su","Singapore, Malaysia",2019,2019,TV-14,"92 min","Horror Movies, International Movies"
80205231,Movie,"Baahubali: The Beginning (English Version)","S.S. Rajamouli","Prabhas, Rana Daggubati, Anushka Shetty, Tamannaah Bhatia, Sathyaraj, Nassar, Ramya Krishnan, Sudeep",India,2018,2015,TV-14,"138 min","Action & Adventure, Dramas, International Movies"
80235864,"TV Show",Bodyguard,,"Richard Madden, Keeley Hawes, Gina McKee, Sophie Rundle, Vincent Franklin, Pippa Haywood, Paul Ready, Tom Brooke, Nicholas Gleaves, Stuart Bowman","United Kingdom",2018,2018,TV-MA,"1 Season","British TV Shows, Crime TV Shows, International TV Shows"
80158919,Movie,"Jack Whitehall: At Large","Brian Klein","Jack Whitehall","United Kingdom",2017,2017,TV-MA,"68 min","Stand-Up Comedy"
80135414,"TV Show","The Mist",,"Morgan Spector, Alyssa Sutherland, Gus Birney, Danica Curcic, Okezie Morro, Luke Cosgrove, Darren Pettie, Russell Posner, Frances Conroy, Dan Butler, Isiah Whitlock Jr.","United States",2017,2017,TV-MA,"1 Season","TV Dramas, TV Horror, TV Mysteries"
70299286,Movie,E-Team,"Katy Chevigny, Ross Kauffman",,"United States",2014,2014,NR,"90 min",Documentaries
70258566,"TV Show","DreamWorks Spooky Stories: Volume 2",,"Seth Rogen, Kiefer Sutherland, Will Arnett, Hugh Laurie, Will Ferrell, David Cross, Sean Bishop, Cody Cameron, Aron Warner",,2012,2011,TV-PG,"1 Season","Kids' TV, TV Comedies"
80017261,Movie,"American Heist","Sarik Andreasyan","Hayden Christensen, Adrien Brody, Jordana Brewster, Tory Kittles, Akon, Luis Da Silva Jr., Lance E. Nichols, Joe Chrest","Canada, Luxembourg",2019,2014,R,"95 min","Action & Adventure, Dramas"
81038022,"TV Show","Breakfast, Lunch & Dinner",,"David Chang, Seth Rogen, Chrissy Teigen, Lena Waithe, Kate McKinnon","United States",2019,2019,TV-MA,"1 Season",Docuseries
80186796,Movie,"Dancing with the Birds","Huw Cordey","Stephen Fry","United States",2019,2019,TV-PG,"52 min",Documentaries
81071891,Movie,"Master Z: The Ip Man Legacy","Yuen Woo-ping","Zhang Jin, Dave Bautista, Michelle Yeoh, Tony Jaa, Liu Yan, Kevin Cheng, Chrissie Chow, Xing Yu","Hong Kong, China",2019,2018,TV-MA,"108 min","Action & Adventure, International Movies"
80224536,Movie,"ADAM SANDLER 100% FRESH","Steve Brill","Adam Sandler","United States",2018,2018,TV-MA,"74 min","Stand-Up Comedy"
81017545,"TV Show","Here to Heart",,"Janine Chun-Ning Chang, Hans Zhang",China,2018,2018,TV-14,"1 Season","International TV Shows, Romantic TV Shows, TV Dramas"
80994444,Movie,"Scorpion King 5: Book of Souls","Don Michael Paul","Zach McGowan, Pearl Thusi, Nathan Jones, Peter Mensah, Katy Louise Saunders, Mayling Ng, Howard Charles, Inge Beckmann","United States",2018,2018,PG-13,"102 min","Action & Adventure, Sci-Fi & Fantasy"
80017286,Movie,"While We're Young","Noah Baumbach","Ben Stiller, Naomi Watts, Adam Driver, Amanda Seyfried, Charles Grodin, Adam Horovitz, Dree Hemingway, Brady Corbet, Maria Dizzia, Matthew Maher, Peter Yarrow, Dean Wareham","United States",2017,2015,R,"97 min","Comedies, Dramas, Independent Movies"
70295169,Movie,"Hunter's Prayer","Jonathan Mostow","Sam Worthington, Odeya Rush, Amy Landecker, Allen Leech, Verónica Echegui","United States, Spain, Germany",2019,2015,R,"91 min","Action & Adventure, Independent Movies"
80039050,Movie,"I'll See You in My Dreams","Brett Haley","Blythe Danner, Martin Starr, June Squibb, Rhea Perlman, Mary Kay Place, Malin Akerman, Sam Elliott, Aarti Mann, Mark Adair-Rios, Ashley Spillers","United States",2019,2015,PG-13,"96 min","Comedies, Dramas, Independent Movies"
81027753,Movie,"Jenny Slate: Stage Fright","Gillian Robespierre","Jenny Slate","United States",2019,2019,TV-MA,"67 min","Documentaries, Stand-Up Comedy"
